{
  "schema_version": "ISRAS-EVIDENCE-BINDING-V1",
  "repository": "Iron-Signal-Systems/example",
  "campaign_id": "example-campaign",
  "candidate_commit": "1111111111111111111111111111111111111111",
  "environment_artifact": {
    "path": "docs/acceptance/evidence/example/environment.json",
    "sha512": "22222222222222222222222222222222222222222222222222222222222222222222222222222222222222222222222222222222222222222222222222222222"
  },
  "declared_test_ids": [
    "TEST-001"
  ],
  "validators": [
    {
      "validator_id": "example-validator",
      "version": "1.0.0",
      "source_commit": "1111111111111111111111111111111111111111",
      "executable_path": "tools/example-validator.py",
      "executable_sha512": "33333333333333333333333333333333333333333333333333333333333333333333333333333333333333333333333333333333333333333333333333333333"
    }
  ],
  "artifacts": [
    {
      "artifact_id": "example-result",
      "path": "docs/acceptance/evidence/example/result.log",
      "sha512": "44444444444444444444444444444444444444444444444444444444444444444444444444444444444444444444444444444444444444444444444444444444",
      "validator_id": "example-validator",
      "test_ids": [
        "TEST-001"
      ],
      "identity_probe": {
        "format": "TEXT",
        "candidate_commit_marker": "candidate_commit=1111111111111111111111111111111111111111",
        "campaign_id_marker": "campaign_id=example-campaign",
        "environment_sha512_marker": "environment_sha512=22222222222222222222222222222222222222222222222222222222222222222222222222222222222222222222222222222222222222222222222222222222"
      },
      "outcome_probe": {
        "format": "TEXT_ISRAS_SUMMARY",
        "pass_marker": "validation PASSED"
      }
    }
  ],
  "claims": [
    {
      "claim_id": "example-claim",
      "control_id": "ISRAS-EVD-008",
      "required_test_ids": [
        "TEST-001"
      ],
      "artifact_ids": [
        "example-result"
      ],
      "expected_outcome": "PASS"
    }
  ]
}
